slug,title,description,treatment,hospital,doctor,treatment_price
laser-hair-removal-salt-skin-studio-east-delhi,Best Laser Hair Removal,"<p>Laser hair removal is a state-of-the-art procedure that uses concentrated laser energy to disable hair follicles, resulting in significant and lasting hair reduction. Its importance lies in offering a reliable, time-saving alternative to repetitive methods like shaving or waxing, which can cause irritation and ingrown hairs. The treatment is precise, safe for most skin types, and suitable for various body areas. Sessions are quick, with minimal discomfort and no downtime. Over time, hair regrowth becomes finer and lighter, making maintenance easier and less frequent. Laser hair removal not only enhances skin smoothness and hygiene but also saves time and money, making it a smart investment for long-term confidence and convenience.</p><p>Choosing Salt Skin Studio for laser hair removal means benefiting from advanced technology, expert practitioners, and a holistic, patient-focused approach. The clinic prioritizes safety, personalized care, and effective results, ensuring a comfortable experience and consistently high satisfaction for those seeking lasting hair reduction solutions</p>","{'name': 'Laser Hair Removal', 'slug': 'laser-hair-removal'}","{'title': 'Salt Skin Studio,  East Delhi', 'slug': 'salt-skin-studio-east-delhi', 'mini_content': 'Salt Skin Studio in Anand Vihar offers advanced, personalized aesthetic treatments using USFDA-approved technology in a serene, modern setting led by Dr. Manu Agarwal.', 'content': '<p><span style=""color: rgb(44, 62, 93); font-family: &quot;Open Sans&quot;, sans-serif; font-size: 16px;"">Dr. Manu Agarwal, MBBS, MD, and a Diploma holder in Dermatology from the UK, is the expert behind Salt Skin Studio, bringing years of focused experience in aesthetic dermatology and laser treatments, Salt Skin Studio is a modern, minimalistic space offering advanced skin, hair, and aesthetic solutions using USFDA-approved technologies. The clinic provides a comprehensive range of services, including laser hair reduction, chemical peels, Botox, dermal fillers, PRP therapy, microneedling (RF), thread lifts, IPL photofacials, HIFU, skin tightening, pigmentation and scar correction, cryolipolysis, wart and skin tag removal, and more. Each treatment is tailored after a detailed consultation, ensuring safety, comfort, and natural-looking results. The clinic emphasizes personalized care, precision, and transparent communication, making it a trusted destination for those seeking subtle, effective, and long-lasting enhancements. With a clean, calming environment and tech-forward approach, Salt Skin Studio sets a high standard in aesthetic dermatology in East Delhi.</span></p>', 'location': 'Surya Niketan, Delhi'}","[{'name': 'Dr. Manu Agarwal', 'qualification': 'MBBS, Doctor of Medicine (MD), Diploma in Dermatology', 'specialization': 'Hair Transplant'}]","{'min_price': '10000.00', 'max_price': '20000.00', 'currency': 'INR'}"
laser-hair-removal-dermatrico-south-delhi,Best Laser Hair Removal Solutions,"<p>Laser hair removal is a scientifically advanced treatment that uses targeted laser energy to disable hair follicles, offering a long-term solution for unwanted hair. Its importance lies in delivering smoother skin, reducing the risk of ingrown hairs, and eliminating the need for constant shaving or waxing, which can cause irritation and discomfort. The procedure is quick, precise, and suitable for various skin types and body areas, with minimal pain and no downtime. Over time, hair regrowth becomes finer and lighter, making maintenance easier and less frequent. Laser hair removal saves both time and money in the long run, boosts confidence, and enhances overall skin texture, making it a valuable investment for lasting results.</p><p>Choosing Dermatrico Delhi for laser hair removal ensures you receive care from experienced professionals using state-of-the-art technology in a safe, hygienic environment. The clinic’s personalized approach, focus on patient comfort, and commitment to consistent, effective results make it a trusted choice for long-term hair reduction.</p>","{'name': 'Laser Hair Removal', 'slug': 'laser-hair-removal'}","{'title': 'Dermatrico, South Delhi', 'slug': 'dermatrico-south-delhi', 'mini_content': 'Dermatrico Clinic in Malviya Nagar delivers expert, evidence-backed skin, hair, and cosmetic care under Dr. Syed Nazim Hussain’s guidance using cutting-edge, globally certified technology.', 'content': '<p class=""selectable-text copyable-text x15bjb6t x1n2onr6"" dir=""ltr""><span class=""selectable-text copyable-text xkrh14z"" style=""white-space-collapse: preserve;"">Led by Dr. Syed Nazim Hussain, a renowned dermatologist, aesthetic dermatologist, and hair transplant surgeon with over 20 years of experience and international training, Dermatrico Clinic is recognized for its evidence-based, technologically advanced skincare solution</span><span style=""white-space-collapse: preserve;"">, the clinic offers a full spectrum of non-surgical and surgical dermatology treatments tailored to Indian skin needs. Their comprehensive services include laser hair removal, acne and scar treatments, pigmentation correction, wart and mole removal, tattoo removal, carbon facials, HydraFacials, chemical peels, microneedling, PRP therapies, Botox, dermal fillers, thread lifts, HIFU, low-level laser therapy, and permanent cosmetics like micropigmentation . Dermatrico is equipped with USFDA and globally-approved technologies, offering vitiligo therapy including excimer lasers, and advanced hair transplants (FUE/FUT). With over a decade of glowing patient reviews. </span><span style=""white-space-collapse: preserve;"">the clinic merges clinical rigor with cosmetic artistry in a warm, patient-centric environment making it a trusted destination for skin, hair, and aesthetic transformation in South Delhi.</span></p>', 'location': 'Malviya, nagar'}","[{'name': 'Dr. Syed Nazim Hussain', 'qualification': 'MD - Physician  Dermatologist,Aesthetic Dermatologist,Hair Transplant Surgeon', 'specialization': 'Hair Transplant specialist'}]","{'min_price': '10000.00', 'max_price': '20000.00', 'currency': 'INR'}"
laser-hair-removal-dermaworld-skin-hair-clinic-west-delhi,Laser Hair Removal Solutions DermaWorld skin and hair clinic,"<p>Laser hair removal is a highly advanced and effective solution for reducing unwanted hair, using targeted laser energy to safely disable hair follicles. This treatment is important because it offers a long-lasting alternative to repetitive shaving or waxing, which often leads to skin irritation, ingrown hairs, and inconvenience. At DermaWorld, the Alma Soprano Ice technology ensures virtually painless sessions, quick treatment times, and suitability for all skin types including darker tones. Over a series of sessions, hair becomes finer and lighter, making maintenance easier and less frequent. The procedure is cost-effective in the long run, enhances skin smoothness, and boosts confidence by eliminating the hassle of daily hair removal routines.</p><p>Choosing DermaWorld for laser hair removal means you benefit from the expertise of Dr. Rohit Batra, a renowned dermatologist, and a clinic equipped with award-winning, FDA-cleared technology. Patients receive personalized care, high safety standards, and consistently effective, painless results, making DermaWorld a trusted destination for permanent hair reduction.</p>","{'name': 'Laser Hair Removal', 'slug': 'laser-hair-removal'}","{'title': 'DermaWorld Skin & Hair Clinic, West Delhi', 'slug': 'dermaworld-skin--hair-clinic-west-delhi', 'mini_content': 'DermaWorld Skin Clinicleading dermatology and aesthetic centre in Rajouri Garden.', 'content': '<p data-start=""78"" data-end=""115"">DermaWorld Skin Clinic is a trusted name in dermatology and aesthetic care, led by the renowned Dr.\u202fRohit\u202fBatra, an experienced dermatologist with an MD in Dermatology, Venereology &amp; Leprosy. With nearly two decades of clinical excellence, Dr. Batra and his team offer specialized care for all skin and hair-related issues, combining medical precision with a compassionate approach. The clinic is equipped with state-of-the-art facilities and uses internationally approved technologies to ensure safe, comfortable, and effective treatments. From laser hair removal using premium-grade devices to advanced solutions for acne scars, pigmentation, and tattoo removal, DermaWorld is committed to delivering visible results. Aesthetic services include Botox, dermal fillers, thread lifts, Profhilo, chemical peels, and HIFU for skin tightening and rejuvenation. Patients also receive expert care for chronic conditions like eczema, psoriasis, vitiligo, fungal infections, urticaria, and nail disorders. For those facing hair loss, the clinic offers PRP therapy, mesotherapy, and hair transplantation with excellent outcomes.</p><div><br></div>', 'location': 'Rajouri Garden, New Delhi'}","[{'name': 'Dr. Rohit Batra', 'qualification': 'M.B.B.S., M.D. | Skin Specialist', 'specialization': 'Hair Transplant specialist'}]","{'min_price': '10000.00', 'max_price': '20000.00', 'currency': 'INR'}"
laser-hair-removal-skinos,Best Laser Hair Removal at Skinos,"<p>Laser hair removal is a highly advanced, noninvasive treatment that uses precise pulses of laser light to permanently destroy hair follicles, providing a long-term solution for unwanted hair. Its importance lies in freeing you from the repetitive cycle of shaving and waxing, which can cause irritation and ingrown hairs. Laser hair removal is pain-free, quick, and safe for all skin types, delivering smooth, hair-free skin with minimal downtime. Over time, hair regrowth becomes finer and lighter, making maintenance effortless. This treatment not only saves time and money but also boosts confidence by ensuring consistently smooth skin and reducing the need for daily grooming.</p><p>Choosing Skinos for laser hair removal means you benefit from the expertise of Dr. Shruti Gupta and the use of advanced diode laser technology. The clinic prioritizes patient comfort, safety, and personalized care, ensuring pain-free, effective results and a superior experience for long-lasting hair reduction.</p>","{'name': 'Laser Hair Removal', 'slug': 'laser-hair-removal'}","{'title': 'Skinos', 'slug': 'skinos-north-delhi', 'mini_content': 'Skinos by Dr. Shruti Gupta delivers safe, ethical, and advanced aesthetic treatments using globally approved technology designed for natural-looking results in a warm setting.', 'content': '<p>Skinos is a modern aesthetic and dermatology clinic located in Kamla Nagar, offering a full spectrum of non-surgical treatments for skin and hair concerns. Founded by Dr. Shruti Gupta, a certified dermatologist with global exposure, the clinic follows a patient-first approach backed by scientific protocols. Known for its clean, welcoming environment and the use of USFDA-approved technology, Skinos specializes in personalized skincare solutions that deliver visible results. The clinic offers a wide array of aesthetic services including laser hair removal, chemical peels, PRP therapy, Botox, fillers, microneedling, acne and pigmentation treatments, hydrafacials, and non-surgical facelifts. Each procedure is customized based on skin type, concern, and individual goals, ensuring safety and effectiveness. With strict hygiene standards and an empathetic team, Skinos has become a trusted choice for those seeking natural, refined enhancements in North Delhi. It’s where clinical expertise meets aesthetic finesse, offering a truly comprehensive skin wellness experience.</p><div><br></div>', 'location': 'Kamla Naga, North Delhi'}","[{'name': 'Dr. Shruti Gupta', 'qualification': 'MD - Dermatology , Venereology & Leprosy, MBBS', 'specialization': 'Hair Transplant specialist'}]","{'min_price': '10000.00', 'max_price': '20000.00', 'currency': 'INR'}"
laser-hair-removal-medlinks-south-west-delhi,Best Laser Hair Removal Solutions,"<p>Laser hair removal is an advanced, noninvasive treatment that uses targeted laser energy to permanently reduce unwanted hair by disabling hair follicles. Its importance lies in offering a long-term solution that is safer and more effective than regular shaving or waxing, which can cause irritation, ingrown hairs, and frequent upkeep. At MedLinks, the use of cutting-edge technology like Diode Laser LightSheer Duet, Diode Laser Alma Soprano, and eLight ensures treatments are fast, virtually painless, and suitable for all skin types and body areas. Over time, hair regrowth becomes finer and lighter, making maintenance minimal. Laser hair removal not only saves time and money but also boosts confidence by delivering consistently smooth, hair-free skin.</p><p>Choosing MedLinks for laser hair removal means you benefit from internationally recognized dermatologists, state-of-the-art infrastructure, and a patient-centric approach. The clinic’s advanced technology, strict hygiene protocols, and commitment to personalized care ensure safe, effective, and lasting results for every patient.</p>","{'name': 'Laser Hair Removal', 'slug': 'laser-hair-removal'}","{'title': 'MedLinks, South West Delhi', 'slug': 'medlinks-south-west-delhi', 'mini_content': 'MedLinks offers advanced hair transplant and skin aesthetic treatments with expert care. Experience world-class results in a state-of-the-art facility in Safdarjung Enclave.', 'content': '<p><span style=""color: rgb(44, 62, 93); font-family: &quot;Open Sans&quot;, sans-serif; font-size: 16px;"">Dr. Gaurang Krishna, internationally acclaimed hair transplant surgeon and inventor of the Perfect hair transplant technique, is the driving force behind MedLinks. With over a decade of experience and a reputation for excellence, he leads a skilled team dedicated to delivering natural-looking, long-lasting results in hair restoration and skin aesthetics. MedLinks is celebrated for its advanced technology, including state-of-the-art micrografting equipment, cutting-edge lasers, and the latest non-surgical devices for skin rejuvenation and body contouring. The clinic provides a comfortable, hygienic environment designed to put patients at ease throughout their treatment journey. Patients benefit from a comprehensive range of aesthetic treatments such as hair transplant (FUE, FUT, PERFECT-i), eyebrow restoration, laser hair removal, microdermabrasion, non-surgical lipolysis, e-dermapen, and anti-aging therapies. With a strong focus on innovation, safety, and personalized care, MedLinks has earned recognition as a top destination for both hair and skin solutions, attracting patients from across India and beyond.</span></p>', 'location': 'Safdarjung Enclave, New Delhi'}","[{'name': 'Dr. Gaurang Krishna', 'qualification': 'MBBS, MD (Dermatology, AIIMS New Delhi)', 'specialization': 'Hair Transplant specialist'}]","{'min_price': '10000.00', 'max_price': '20000.00', 'currency': 'INR'}"
laser-hair-removal-alive-wellness-clinics-south-east-delhi,Laser Hair Removal Solutions At Alive Wellness Clinics,"<p>Laser hair removal is a modern, non-invasive treatment that uses concentrated light energy to target and destroy hair follicles, providing a long-term solution for unwanted hair. Its importance lies in delivering smooth, hair-free skin without the constant need for shaving or waxing, which can cause irritation and ingrown hairs. The procedure is quick, precise, and suitable for most skin types and body areas, with minimal discomfort and downtime. At Alive Wellness Clinics, advanced technology and expert professionals ensure treatments are tailored to individual needs, maximizing safety and effectiveness. Over time, hair regrowth becomes finer and lighter, making maintenance easier. Laser hair removal saves time, effort, and money in the long run, enhancing confidence and skin health.</p><p>Choosing Alive Wellness for laser hair removal means you benefit from state-of-the-art technology, experienced specialists, and personalized care. The clinic offers customized treatment plans, competitive pricing, and a reputation for delivering safe, effective, and comfortable results tailored to your skin and hair type.</p>","{'name': 'Laser Hair Removal', 'slug': 'laser-hair-removal'}","{'title': 'Alive Wellness Clinics, South East Delhi', 'slug': 'alive-wellness-clinics-south-east-delhi', 'mini_content': 'Alive Wellness Clinics offers expert dermatology and advanced aesthetic treatments. Experience holistic care and real results at the Lajpat Nagar center.', 'content': '<p><span style=""color: rgb(44, 62, 93); font-family: &quot;Open Sans&quot;, sans-serif; font-size: 16px;"">Alive Wellness Clinics is led by Dr. Chiranjiv Chhabra, a highly acclaimed cosmetic surgeon and wellness expert with over 25 years of experience. Dr. Chhabra’s vision and leadership have established the clinic as a center of excellence in dermatology and aesthetic medicine. Supported by a team of skilled dermatologists and cosmetologists, she ensures every patient receives personalized care tailored to their unique needs. The clinic is renowned for its holistic approach to beauty and wellness, offering a comprehensive range of advanced treatments for skin, hair, and body concerns. With state-of-the-art infrastructure and cutting-edge technology, Alive Wellness Clinics provides both invasive and non-invasive procedures in a welcoming, safe environment. Patients benefit from innovative solutions such as anti-aging therapies, body contouring, hair restoration, acne and pigmentation treatments, injectables, and regenerative therapies. The clinic’s commitment to patient education, safety, and excellence makes it a trusted choice for those seeking transformative results and a renewed sense of confidence and well-being.</span></p>', 'location': 'Lajpat Nagar, Delhi'}","[{'name': 'Dr. Chiranjiv Chhabra', 'qualification': 'MBBS, MD - Dermatology , Venereology & Leprosy', 'specialization': 'Hair Transplant'}]","{'min_price': '10000.00', 'max_price': '20000.00', 'currency': 'INR'}"
laser-hair-removal-divine-aesthetics-surgery-south-delhi,Laser Hair Removal Solutions At Divine Aesthetics,"<p>Laser hair removal is an advanced, noninvasive procedure that uses focused laser energy to target and disable hair follicles, providing long-lasting reduction of unwanted hair. This treatment is important because it offers a reliable, efficient alternative to constant shaving or waxing, which can cause irritation and ingrown hairs. Laser hair removal is quick, precise, and suitable for various skin types and body areas, with minimal discomfort and no downtime. Over time, hair regrowth becomes finer and lighter, making maintenance easier and less frequent. The procedure saves time, reduces skin problems, and boosts confidence by delivering smoother, hair-free skin. At Divine Aesthetics, the use of state-of-the-art laser technology ensures safe, effective, and customized treatments for every patient.</p><p>Choosing Divine Aesthetics for laser hair removal means benefiting from a team of highly trained, board-certified specialists, a modern facility in Greater Kailash, and a commitment to personalized care and natural-looking results. The clinic’s advanced technology and patient-centric approach ensure consistently safe, comfortable, and effective hair reduction.</p>","{'name': 'Laser Hair Removal', 'slug': 'laser-hair-removal'}","{'title': 'Divine Aesthetics Surgery, South Delhi', 'slug': 'divine-aesthetics-surgery-south-delhi', 'mini_content': 'provides world-class plastic and cosmetic surgery in Greater Kailash. Experience expert care and advanced treatments in a luxurious, patient-focused environment.', 'content': '<p>Divine Aesthetic Surgery is led by Dr. Amit Gupta, a board-certified plastic and aesthetic surgeon with over 19 years of experience, and patient satisfaction to every procedure. Dr. Gupta is a graduate of Maulana Azad Medical College and holds international fellowships, recognized as a leading expert in cosmetic surgery both in India and abroad. The clinic is celebrated as one of the largest and most advanced plastic surgery centers in North India, offering a luxurious, safe, and hygienic environment with state-of-the-art facilities and a dedicated team of over 50 plastic surgeons. Divine Aesthetic Surgery LLP specializes in a comprehensive range of aesthetic and cosmetic procedures, including hair transplant, 4D body contouring, breast augmentation, liposuction, mommy makeovers, facial rejuvenation, rhinoplasty, Botox, dermal fillers, gynecomastia surgery, and skin rejuvenation, ensuring personalized care and natural-looking results for every patient.</p>', 'location': 'Greater Kailash, Delhi'}","[{'name': 'Dr. Amit Gupta', 'qualification': 'MBBS, DNB - Plastic Surgery', 'specialization': 'Hair Transplant specialist'}]","{'min_price': '10000.00', 'max_price': '20000.00', 'currency': 'INR'}"
laser-hair-removal-the-skin-dna-west-delhi,Best Laser Hair Removal at THE SKIN DNA,"<p>Laser hair removal is a clinically proven technique that uses focused laser energy to target and reduce unwanted hair, providing a long-term solution that surpasses traditional methods like waxing or shaving. This treatment is important because it offers smoother skin, minimizes the risk of ingrown hairs, and reduces the need for constant maintenance. At The Skin DNA, advanced laser technology ensures precise, safe, and effective hair reduction for all skin types and body areas. Under the care of experienced dermatologists like Dr. Mayuri Jain, each session is tailored to individual needs, ensuring optimal comfort and results. Over time, hair regrowth becomes finer and lighter, making upkeep minimal. Laser hair removal is a smart investment for anyone seeking convenience, confidence, and improved skin texture.</p><p>Choosing The Skin DNA in Delhi for laser hair removal means benefiting from the expertise of internationally trained dermatologists, cutting-edge technology, and a patient-first approach. The clinic’s commitment to personalized care, scientific evidence-based treatments, and a welcoming environment ensures consistently high satisfaction and safe, effective outcomes for every patient.</p>","{'name': 'Laser Hair Removal', 'slug': 'laser-hair-removal'}","{'title': 'THE SKIN DNA, West Delhi', 'slug': 'the-skin-dna-west-delhi', 'mini_content': 'THE SKIN DNA offers advanced skin and hair treatments under Dr. Mayuri Jain. Experience expert care and natural results in a welcoming environment in Punjabi Bagh.', 'content': '<p>Dr. Mayuri Jain leads THE SKIN DNA, bringing her expertise as a renowned dermatologist and cosmetologist with advanced training in skin and hair care. Dr. Jain is recognized for her patient-centric approach, personalized treatment plans, and commitment to delivering natural-looking results. THE SKIN DNA clinic is celebrated for its warm, welcoming environment and state-of-the-art technology, ensuring safe and effective procedures for every patient. The clinic emphasizes hygiene, comfort, and professionalism, making it a trusted destination for cosmetic and dermatological treatments. THE SKIN DNA offers a comprehensive range of aesthetic services, including laser hair removal, botox, dermal fillers, chemical peels, microdermabrasion, skin tightening, acne and scar treatment, hair transplant, PRP therapy for hair growth, pigmentation and melasma treatment, skin rejuvenation, anti-aging therapies, and scalp treatments. Patients benefit from expert care and innovative solutions designed to enhance skin health and beauty.&nbsp;&nbsp;</p>', 'location': 'Punjabi Bagh, Delhi'}","[{'name': 'Dr. Mayuri Jain', 'qualification': 'MBBS, MD - Dermatology , Venereology & Leprosy', 'specialization': 'Hair Transplant'}]","{'min_price': '10000.00', 'max_price': '20000.00', 'currency': 'INR'}"
