slug,title,description,treatment,hospital,doctor,treatment_price
hair-transplant-skinfollics-clinic,Best Hair Transplant,"<p>Hair transplant offers a permanent solution for baldness and hair thinning through advanced techniques like FUE and FUT, delivering natural-looking, long-lasting results. It’s minimally invasive with little downtime, minimal scarring, and gradually restores fuller density and hairline. This boosts self-esteem and enhances appearance over time, making it a preferred choice for those seeking effective hair restoration.</p><p>Skinfollics, located Malviya Nagar, is led by an ex‑AIIMS senior dermatologist and offers evidence‑based, affordable care with minimal unnecessary medications the clinic focuses on personalized hair transplant and dermato‑surgical treatments using modern infrastructure, strong hygiene standards, and friendly support, making it a trustworthy option for quality and value .</p><p><br></p>","{'name': 'Hair Transplant', 'slug': 'hair-transplant'}","{'title': 'Skinfollics Clinic', 'slug': 'skinfollics-clinic', 'mini_content': 'Advanced skin & hair treatments at Skinfollics Clinic.', 'content': '<p>Skinfollics Clinic, located in Malviya Nagar, Delhi, is a modern skin and hair clinic offering advanced dermatological solutions for all age groups. The clinic specializes in treating common to complex skin and hair issues using safe, medically proven methods and the latest technology. Whether you are dealing with acne, pigmentation, dull skin, wrinkles, or hair fall, Skinfollics provides personalized treatment plans tailored to your needs. Each consultation involves a detailed skin or scalp analysis to ensure accurate diagnosis and the most effective care. The clinic maintains high standards of hygiene, comfort, and professionalism. With a focus on visible, long-lasting results, Skinfollics Clinic offers services like laser hair removal, PRP therapy, chemical peels, skin rejuvenation, and anti-aging treatments. All procedures are performed by trained professionals using advanced tools in a clean, private environment. Skinfollics is known for its patient-first approach, transparent consultations, and a commitment to enhancing natural beauty through expert care.</p>', 'location': 'Malviya Nagar, New Delhi'}","[{'name': 'Dr. Vipul Pareek', 'qualification': 'MBBS, MD', 'specialization': 'Dermatology'}]","{'min_price': '45000.00', 'max_price': '80000.00', 'currency': 'INR'}"
hair-transplant-dermaiims-clinic,Best Hair Transplant,"<p>Hair transplant provides a permanent and natural solution for baldness and hair thinning using advanced methods like FUE, FUT, or MY-DHT. These techniques ensure minimal scarring, quick recovery, and long-lasting, natural-looking density. Patients often experience a significant boost in self-confidence, a restored hairline, and improved appearance with sustainable results over time.</p><p>Dermaiims is led by AIIMS-trained dermatologist Dr. Ramesh Pratap and specializes in advanced hair restoration techniques. The clinic is known for its high surgical precision, modern infrastructure, and excellent hygiene. With over 8,000 successful procedures, Dermaiims offers personalized care, natural results, and strong post-operative support, making it a trusted name in hair transplants.</p><div><br></div>","{'name': 'Hair Transplant', 'slug': 'hair-transplant'}","{'title': 'Dermaiims Clinic', 'slug': 'dermaiims-clinic', 'mini_content': ""Dermaiims is India's leading skin and hair clinic."", 'content': '<p><span style=""background-color: rgb(255, 255, 255);""><span style=""font-size: 12px;"">Dermaiims Clinic, situated in Safdarjung, Delhi, offers advanced skin and hair treatments under the expert guidance of&nbsp;&nbsp;</span><span style=""font-family: &quot;Google Sans&quot;, Roboto, Arial, sans-serif; font-size: 12px;"">Dr. Ramesh Pratap AIIMS trained dermatologist</span><span style=""font-size: 12px;"">, a reputed dermatologist known for her patient-centric approach and effective solutions. The clinic combines modern technology with personalized care to treat a wide range of dermatological and cosmetic concerns.&nbsp;</span><span style=""font-family: &quot;Google Sans&quot;, Roboto, Arial, sans-serif; font-size: 12px;"">Dr. Ramesh Pratap</span><span style=""font-size: 12px;"">&nbsp;specializes in managing acne, pigmentation, hair loss, and signs of aging through safe and scientifically proven methods. Using advanced equipment like lasers, PRP therapy, and chemical peels, Dermaiims Clinic delivers visible and lasting results with minimal discomfort or downtime. Every patient receives a thorough consultation and a customized treatment plan based on their skin and hair needs. The clinic maintains strict hygiene and offers a comfortable environment to ensure patient satisfaction. Whether you want to clear acne scars, reduce pigmentation, control hair fall, or reverse aging signs, Dermaiims Clinic with </span><span style=""font-family: &quot;Google Sans&quot;, Roboto, Arial, sans-serif; font-size: 12px;"">Dr. Ramesh Pratap</span><span style=""font-size: 12px;"">&nbsp;is a trusted choice for quality dermatology care in Safdarjung.</span></span></p><p><br></p>', 'location': 'Safdarjung Enclave,  New Delhi'}","[{'name': 'Dr. Ramesh Pratap', 'qualification': 'MBBS, MD - Dermatology , Venereology & Leprosy', 'specialization': 'Dermatology'}]","{'min_price': '50000.00', 'max_price': '80000.00', 'currency': 'INR'}"
hair-transplant-influennz-skin-hair-clinic,Best Hair Transplant,"<p>Hair transplant is a permanent and effective solution for hair loss and thinning. Techniques like FUE and DHI restore natural hair growth with minimal scarring and downtime. The results are long-lasting, natural-looking, and can significantly improve a person's confidence, appearance, and overall self-image.</p><p>Influennz Clinic, led by AIIMS-trained dermatologist Dr. Geetika Srivastava, offers advanced hair transplant solutions using precise techniques like DHI and FUE. Known for high graft survival rates, personalized treatment plans, and excellent hygiene standards, the clinic provides safe, result-oriented care in a modern and patient-friendly environment.</p>","{'name': 'Hair Transplant', 'slug': 'hair-transplant'}","{'title': 'Influennz Skin & Hair Clinic', 'slug': 'influennz-skin--hair-clinic', 'mini_content': 'Expert skin & hair care at Influennz Clinic, Hauz Khas.', 'content': '<p data-start=""586"" data-end=""879""><span data-start=""586"" data-end=""618"" style="""">Influennz Skin &amp; Hair Clinic</span>, located in <span data-start=""631"" data-end=""651"" style="""">Hauz Khas, Delhi</span>, is a trusted center for advanced skin and hair treatments. The clinic is led by experienced dermatologist <span data-start=""759"" data-end=""785"" style="""">Dr. Geetika Srivastava</span>, known for her personalized approach and deep expertise in clinical and cosmetic dermatology. Dr. Geetika Srivastava offers specialized care for conditions like acne, pigmentation, hair fall, and signs of aging. Each patient is given a customized treatment plan after a detailed consultation and skin/hair analysis. The clinic combines safe medical practices with modern technology to deliver visible, natural-looking results. Using USFDA-approved equipment, the clinic provides services such as laser hair removal, PRP therapy, chemical peels, anti-aging injectables, and skin rejuvenation procedures. The environment is hygienic, professional, and designed to make patients feel comfortable and confident. Whether you\'re seeking to restore your skin’s health, treat hair loss, or enhance your appearance, <span data-start=""1596"" data-end=""1622"">Dr. Geetika Srivastava</span> and the team at Influennz Clinic offer reliable, effective care tailored to your unique needs.</p>', 'location': 'Hauz Khas, New Delhi'}","[{'name': 'Dr. Geetika Srivastava', 'qualification': 'MBBS, MD', 'specialization': 'Dermatology'}]","{'min_price': '50000.00', 'max_price': '90000.00', 'currency': 'INR'}"
hair-transplant-dr-jyoti-gupta,Best Hair Transplant,"<p>Hair transplant offers a permanent, natural-looking solution for hair loss and thinning. Advanced techniques like FUE, DHI, and FUT deliver fuller hairlines with minimal scarring and little downtime. Patients benefit from long-lasting results that seamlessly integrate with existing growth—greatly boosting self-esteem, enhancing overall appearance, and promoting a more youthful, confident look.</p><p>Dr. Jyoti Gupta Clinic, located in South Delhi, is led by an experienced, board-certified dermatologist specializing in hair restoration. The clinic is known for its compassionate care, customized treatment plans, and use of state-of-the-art equipment. With focus on precision, high graft survival, and meticulous hygiene, the clinic supports patients through every step from consultation to post-op follow-up making it a respected and reliable choice for hair transplant procedures.</p><div><br></div>","{'name': 'Hair Transplant', 'slug': 'hair-transplant'}","{'title': 'Dr. Jyoti Gupta', 'slug': 'dr-jyoti-gupta', 'mini_content': 'Advanced skin, hair & cosmetic procedures.', 'content': '<p data-start=""369"" data-end=""758""><span data-start=""369"" data-end=""395"" style="""">Dr. Jyoti Gupta Clinic</span>, located in <span data-start=""408"" data-end=""452"" style="""">Panchsheel Enclave, Malviya Nagar, Delhi</span>, is a premier dermatology and aesthetic center led by <span data-start=""507"" data-end=""526"" style="""">Dr. Jyoti Gupta</span>, an award-winning, board-certified dermatologist with an MD in Dermatology. Known for her clinical expertise and natural aesthetic results, Dr. Gupta is highly regarded for her ethical and scientific approach to skin and hair care. With years of experience in cosmetic dermatology, lasers, and hair transplant surgery, she provides comprehensive, personalized care for concerns like acne, pigmentation, scars, hair loss, and aging. Each patient undergoes a detailed consultation followed by a customized treatment plan using advanced and USFDA-approved technologies. The clinic offers a wide range of services including chemical peels, Botox, fillers, PRP therapy, and laser treatments—all performed with precision and safety. Hair transplants, including scalp, beard, and eyebrows, are done using advanced FUE techniques. Patients trust <span data-start=""1367"" data-end=""1386"">Dr. Jyoti Gupta</span> for visible, lasting results delivered in a hygienic, professional, and compassionate environment.</p>', 'location': 'panchsheel enclave ,New Delhi'}","[{'name': 'Dr. Jyoti Gupta', 'qualification': 'MBBS, M.D.', 'specialization': 'Dermatology'}]","{'min_price': '50000.00', 'max_price': '80000.00', 'currency': 'INR'}"
hair-transplant-orange-tree-clinic-south-delhi,Best Hair Transplant,"<p>Hair transplant offers a permanent and natural-looking solution for hair thinning and baldness. Techniques like FUE and FUT restore hair density with minimal scarring and quick recovery. New hair typically begins to grow within a few months, with full results visible in about a year. This boosts confidence and improves overall appearance.</p><p>Orange Tree Clinic, led by AIIMS-trained plastic surgeon Dr. Sajal Halder, specializes in advanced hair restoration. The clinic is known for high graft counts, modern technology, and personalized care. With thousands of successful procedures, it provides safe, cost-effective, and result-driven treatments in a well-equipped and hygienic environment.</p>","{'name': 'Hair Transplant', 'slug': 'hair-transplant'}","{'title': 'Orange Tree Clinic, South Delhi', 'slug': 'orange-tree-clinic-south-delhi', 'mini_content': 'Advanced skin, hair & aesthetic solutions at Orange Tree.', 'content': ""<p>Orange Tree clinic, located in Defence colony a reputed and trusted clinic led by Dr. Sajal Halder, a skilled and experienced dermatologist and hair transplant surgeon. Known for his ethical approach and advanced clinical expertise, Dr. Halder offers comprehensive skin and hair treatments tailored to individual needs. The clinic specializes in both non-surgical and surgical aesthetic solutions, combining medical precision with cutting-edge technology to deliver safe and lasting results. Dr. Sajal Halder and his team design personalized plans based on each patient's skin type, hair condition, and aesthetic goals. Every procedure is performed with a focus on comfort, effectiveness, and natural outcomes. Orange Tree offers a wide range of dermatological and cosmetic services such as laser hair removal, PRP therapy, chemical peels, advanced FUE hair transplants, Botox, dermal fillers, anti-aging treatments, and skin rejuvenation therapies. The clinic maintains strict hygiene protocols and uses only USFDA-approved equipment, ensuring high standards of safety and care.</p>"", 'location': 'Defence Colony, New Delhi'}","[{'name': 'Dr. Sajal Halder', 'qualification': 'MBBS, MS', 'specialization': 'Plastic Surgery'}]","{'min_price': '50000.00', 'max_price': '80000.00', 'currency': 'INR'}"
hair-transplant-twacha-skin-clinic,Best Hair Transplant,"<p>Hair transplant offers a long-term, natural-looking solution for hair loss and thinning. Techniques like FUE, FUT, PRP, and other regenerative therapies restore hair density with minimal downtime and scarring. Results become noticeable within a few months and continue to improve over time, helping patients regain a youthful appearance and renewed confidence.</p><p>Twacha Clinic stands out for its expert team, advanced technology, and personalized approach to hair restoration. Founded by renowned dermatologists Dr. Tapesh Sharma and Dr. Richa Sharma, the clinic is praised for its professionalism, patient care, and visible results. With a strong reputation for excellence and a commitment to quality, Twacha has earned the trust of thousands seeking effective hair and skin solutions.</p>","{'name': 'Hair Transplant', 'slug': 'hair-transplant'}","{'title': 'Twacha Skin Clinic', 'slug': 'twacha-skin-clinic', 'mini_content': 'Personalized skin, hair & laser treatments at Twacha Skin Clinic.', 'content': '<div>Twacha Skin Clinic, located in Dwarka Sector‑12A, New Delhi, is a premier centre with over 17 years of excellence in dermatology and aesthetic care. Founded and led by Dr. Tapesh Sharma and Dr. Richa Sharma, both highly experienced dermatologists, the clinic is renowned for delivering world-class skin and hair treatments with a focus on safety, personalization, and visible results. The clinic spans a modern 3,000 sq ft facility featuring private consultation rooms, treatment chambers, a photography suite, and an in-house pharmacy. The doctors prioritize detailed consultations to design treatment plans that are tailored to individual skin types and concerns, ensuring both comfort and efficacy. Twacha offers a full range of services, including laser hair removal, chemical peels, medi-facials, PRP therapy, Botox, fillers, pigmentation correction, and advanced anti-aging solutions. With USFDA-approved technology and the highest hygiene standards, every treatment is backed by medical expertise and care. Whether it’s acne, hair fall, or cosmetic enhancement, Dr. Tapesh and Dr. Richa Sharma provide results that are natural-looking, safe, and trusted by patients across Delhi.</div><div><br></div>', 'location': 'Dwarka, New Delhi'}","[{'name': 'Dr. Richa Sharma', 'qualification': 'MBBS, MD', 'specialization': 'Dermatology'}]","{'min_price': '50000.00', 'max_price': '80000.00', 'currency': 'INR'}"
hair-transplant-dermaheal,Best Hair Transplant,"<p>Hair transplant provides a long-lasting, natural solution for hair thinning and baldness. Techniques like FUE and regenerative therapies such as PRP restore hair density with minimal discomfort and downtime. Results become visible within months and continue to improve, helping individuals regain a youthful look and renewed self-confidence.</p><p>Dermaheal Clinic, led by Dr. Navjot Singh Arora (MBBS, MD – Dermatology), is well-regarded for its expertise in hair and skin treatments. With over 13 years of experience, Dr. Arora is known for his ethical approach, personalized care, and excellent results. Patients consistently praise his professionalism, attentive consultation, and the clinic’s welcoming environment. Dermaheal is a trusted choice for those seeking effective and safe hair restoration solutions.</p>","{'name': 'Hair Transplant', 'slug': 'hair-transplant'}","{'title': 'Dermaheal', 'slug': 'dermaheal', 'mini_content': 'Dermaheal Skin & Hair Clinic, offers trusted dermatology and cosmetic solutions.', 'content': '<p data-start=""245"" data-end=""1346"">At Dermaheal Skin &amp; Hair Clinic, <span data-start=""310"" data-end=""336"" style="""">Dr.\u202fNavjot\u202fSingh\u202fArora</span>, MD (Dermatology, Venereology &amp; Leprosy), brings over a decade of expertise to help patients achieve healthier, more radiant skin. Located in Dwarka Sector 7, the clinic specializes in personalized care—from skin rejuvenation and anti-aging treatments to hair restoration and scar reduction. Using advanced, FDA-approved technologies like Q‑switched Nd:YAG for pigmentation, CO₂ fractional lasers for scars, and diode lasers for hair removal, Dermaheal blends medical precision with cosmetic artistry. The team also performs PRP microneedling for acne scars and hair growth, dermal fillers to restore volume, and specialized peels to tackle pigmentation and sun damage. With a focus on safety and comfort, the clinic ensures each treatment is tailored to individual needs. Patients appreciate the clear explanations, caring approach, and visible results. Whether you\'re dealing with acne, hair loss, aging skin, or pigmentation issues, Dermaheal delivers expert solutions in a welcoming, professional setting.</p>', 'location': 'Dwarka, New Delhi'}","[{'name': 'Dr. Navjot Singh Arora', 'qualification': 'MBBS, MD', 'specialization': 'Dermatology'}]","{'min_price': '50000.00', 'max_price': '80000.00', 'currency': 'INR'}"
hair-transplant-dadu-medical-centre-west-delhi,Best Hair Transplant,"<p>Hair transplant is a lasting, natural‑looking solution for hair thinning and baldness. Utilizing advanced techniques like FUE and regenerative therapies, the procedure restores hair density with minimal scarring and downtime. Results begin to show within a few months, enhancing facial balance and boosting self-esteem through visible, long-term improvement.</p><p>Dadu Medical Centre led by founder Dr. Nivedita Dadu and chief surgeon Dr. Nandini Dadu, is widely recognized for its excellence in skin and hair specialist services in Delhi. The clinic combines scientific rigor with personalized care offering advanced FUE procedures, bespoke root‑restore protocols, and artistic hairline design. Patients consistently praise its professional staff, calming environment, and strong results. With multiple branches and a high reputation for quality and ethics, Dadu Medical Centre is a top choice for reliable hair restoration</p>","{'name': 'Hair Transplant', 'slug': 'hair-transplant'}","{'title': 'Dadu Medical Centre, West Delhi', 'slug': 'dadu-medical-centre', 'mini_content': 'Dadu Medical Centre is a premier skin and hair clinic.', 'content': '<p data-start=""318"" data-end=""1504"">At Dadu Medical Centre, <span data-start=""342"" data-end=""363"" style="""">Dr.\u202fNivedita\u202fDadu</span>, MBBS, DDVL, DNB (Dermatology &amp; Venereology), along with senior consultant <span data-start=""439"" data-end=""459"" style="""">Dr.\u202fNandini\u202fDadu</span>, offers world-class dermatology and cosmetic care across their Vasant Vihar and Rajouri Garden centres. With state-of-the-art operation theatres, a dedicated DMC Trichology unit for hair transplants, and 24/7 in-house pharmacy, the clinic combines medical precision with patient comfort. They specialize in both clinical and aesthetic treatments—from managing acne, eczema, pigmentation, and vitiligo to non-surgical facial enhancements like Botox, fillers, thread lifting, Ultherapy, and chemical peels. The hair transplant team ensures high graft success with minimal discomfort. Innovative non-surgical body shaping and FDA-approved laser therapies for hair removal and scar reduction give you aesthetic results with zero downtime. A positive, relaxed ambiance and highly qualified staff deliver personalized plans and visible results. Whether you\'re looking for clear skin, hair restoration, age-defying treatments, or body contouring, Dadu Medical Centre offers comprehensive, patient-first solutions across two convenient Delhi locations.</p>', 'location': 'Rajouri Garden, New Delhi'}","[{'name': 'Dr. Nivedita Dadu', 'qualification': 'MBBS, DDVL', 'specialization': 'Dermatology'}]","{'min_price': '50000.00', 'max_price': '80000.00', 'currency': 'INR'}"
hair-transplant-amulya-clinic,Best Hair Transplant,"<p>Hair transplant offers a durable and natural-looking solution to hair thinning and baldness. Using proven techniques like FUE and regenerative treatments, it restores hair density with minimal downtime and scarring. New growth typically becomes visible within a few months, improving gradually for a fuller hairline and enhanced facial harmony—boosting self-esteem and delivering long-lasting results.</p><p>Amulya Clinic, founded and led by Dr. Charanjeev Sobti, an experienced plastic surgeon with over three decades in cosmetic and hair restoration procedures, is known for professional care and affordability. Patients frequently commend the clinic’s warm approach, skilled artistry in hairline design, and ethical practices. With strong patient satisfaction and a reputation for personalized, compassionate services, it’s a trusted option for reliable hair transplant and aesthetic surgery in Delhi.</p><p><br></p>","{'name': 'Hair Transplant', 'slug': 'hair-transplant'}","{'title': 'Amulya Clinic', 'slug': 'amulya-clinic', 'mini_content': 'Dr. Amulya, the clinic offers expert skin, hair, and wellness care.', 'content': '<p data-start=""197"" data-end=""578""><span data-start=""197"" data-end=""214"" style="""">Amulya Clinic</span>, led by the experienced <span data-start=""239"" data-end=""253"" style="""">Dr. Amulya</span>, offers expert care in skin, hair, and aesthetic treatments. Known for combining medical expertise with advanced technology, the clinic provides safe, personalized solutions for all skin types and hair concerns. Dr. Amulya takes a patient-centric approach, ensuring every treatment is tailored to individual needs and goals. From acne, pigmentation, and anti-aging concerns to hair fall and dull skin, Amulya Clinic addresses a wide range of issues with precision and care. Popular treatments include chemical peels, laser hair removal, PRP therapy, Botox, fillers, and advanced facials. The clinic also offers body contouring and scar reduction services. With a clean, modern setting and the latest equipment, Amulya Clinic ensures a comfortable experience and visible results. Dr. Amulya and her team are dedicated to helping clients enhance their natural beauty safely and effectively. Trusted by many, Amulya Clinic is a go-to destination for comprehensive, non-surgical aesthetic care.</p>', 'location': 'East Patel Nagar,  New Delhi'}","[{'name': 'Dr. Charanjeev Sobti', 'qualification': 'MBBS, MS, MCH & DNB', 'specialization': 'Dermatology'}]","{'min_price': '45000.00', 'max_price': '80000.00', 'currency': 'INR'}"
