slug,title,description,treatment,hospital,doctor,treatment_price
hair-transplant-medlinks-south-west-delhi,Best Hair Transplant Solutions at Medlinks,"<p>Hair transplant is a reliable, minimally invasive procedure that restores natural hair growth by transferring healthy follicles to areas of thinning or baldness. Its importance lies in offering a permanent, natural-looking solution that enhances self-esteem and appearance. Modern techniques, such as FUE and FUT, ensure precise placement, minimal discomfort, and quick recovery. Transplanted hair grows and behaves like natural hair, requiring no special maintenance. This one-time investment eliminates the need for ongoing temporary treatments, saving time and money. Hair transplants provide lasting, discreet results, making them an effective choice for those seeking a transformative answer to hair loss.</p><p>MedLinks South Delhi is repeatedly recognized as the best hair transplant clinic in Delhi NCR, led by internationally trained surgeons and pioneers of advanced techniques like the PERFECT-i procedure. The clinic ensures natural results, strict hygiene, and personalized care, with a proven track record of thousands of successful transplants and high patient satisfaction.</p>","{'name': 'Hair Transplant', 'slug': 'hair-transplant'}","{'title': 'MedLinks, South West Delhi', 'slug': 'medlinks-south-west-delhi', 'mini_content': 'MedLinks offers advanced hair transplant and skin aesthetic treatments with expert care. Experience world-class results in a state-of-the-art facility in Safdarjung Enclave.', 'content': '<p><span style=""color: rgb(44, 62, 93); font-family: &quot;Open Sans&quot;, sans-serif; font-size: 16px;"">Dr. Gaurang Krishna, internationally acclaimed hair transplant surgeon and inventor of the Perfect hair transplant technique, is the driving force behind MedLinks. With over a decade of experience and a reputation for excellence, he leads a skilled team dedicated to delivering natural-looking, long-lasting results in hair restoration and skin aesthetics. MedLinks is celebrated for its advanced technology, including state-of-the-art micrografting equipment, cutting-edge lasers, and the latest non-surgical devices for skin rejuvenation and body contouring. The clinic provides a comfortable, hygienic environment designed to put patients at ease throughout their treatment journey. Patients benefit from a comprehensive range of aesthetic treatments such as hair transplant (FUE, FUT, PERFECT-i), eyebrow restoration, laser hair removal, microdermabrasion, non-surgical lipolysis, e-dermapen, and anti-aging therapies. With a strong focus on innovation, safety, and personalized care, MedLinks has earned recognition as a top destination for both hair and skin solutions, attracting patients from across India and beyond.</span></p>', 'location': 'Safdarjung Enclave, New Delhi'}","[{'name': 'Dr. Gaurang Krishna', 'qualification': 'MBBS, MD (Dermatology, AIIMS New Delhi)', 'specialization': 'Hair Transplant specialist'}]","{'min_price': '50000.00', 'max_price': '80000.00', 'currency': 'INR'}"
laser-hair-removal-uncover-west-delhi,Best Laser Hair Removal at UNCOVER,"<div>Laser hair removal is a cutting-edge solution for long-term reduction of unwanted hair, using focused light energy to target and disable hair follicles. This treatment is important because it offers precise, virtually painless hair removal with minimal risk of skin irritation or ingrown hairs compared to waxing or shaving. Suitable for all skin types and multiple body areas, laser hair removal delivers smoother skin, reduces regrowth, and saves time and money in the long run. Sessions are quick, hygienic, and overseen by trained professionals, making it a safe, convenient, and confidence-boosting option for lasting hair-free results.</div><div><br></div><div>Uncover stands out for its advanced multi-grade laser technology, experienced specialists, and commitment to patient safety. The clinic offers tailored protocols for different skin and hair types, ensuring effective, comfortable treatments. Their transparent approach, modern equipment, and focus on hygiene make Uncover a trusted destination for reliable laser hair removal.</div>","{'name': 'Laser Hair Removal', 'slug': 'laser-hair-removal'}","{'title': 'UNCOVER, West Delhi', 'slug': 'uncover-west-delhi', 'mini_content': 'UNCOVER Laser, Skin & Hair Clinic offers expert care for skin and hair concerns. Experience advanced treatments in a welcoming environment at Punjabi Bagh, Delhi.', 'content': '<p>UNCOVER Laser, Skin &amp; Hair Clinic stands as a trusted destination for advanced aesthetic care in Punjabi Bagh, Delhi. Led by experienced dermatologists, the clinic specializes in delivering safe and effective solutions for a wide range of skin and hair concerns. Patients can expect personalized treatment plans for issues such as laser hair removal, acne, scars, pigmentation, hair loss, and body contouring. The clinic is equipped with cutting-edge technology, including the latest laser devices and non-invasive body sculpting equipment, ensuring optimal results with minimal downtime. The expert team is dedicated to providing a comfortable and hygienic environment, making every visit a pleasant experience. UNCOVER Clinic is committed to patient education and empowerment, helping individuals achieve their aesthetic goals through scientifically proven treatments. Whether seeking to enhance skin clarity, restore hair density, or achieve a more contoured physique, clients receive compassionate care and professional guidance throughout their journey at UNCOVER.</p><div style=""box-sizing: inherit;""><br style=""box-sizing: inherit; color: rgb(44, 62, 93); font-family: &quot;Open Sans&quot;, sans-serif; font-size: 16px;""></div><div style=""box-sizing: inherit;""></div>', 'location': 'Punjabi Bagh, Delhi'}","[{'name': 'Dr. Richa Chaudhary', 'qualification': 'MBBS, MD - Dermatology , Venereology & Leprosy', 'specialization': 'Laser Hair Removal'}]","{'min_price': '10000.00', 'max_price': '20000.00', 'currency': 'INR'}"
hair-transplant-skinhealer,Best Hair Transplant,"<p>Hair transplant is a reliable and permanent solution for hair loss, offering natural hair regrowth and improved appearance. It enhances self-esteem and requires minimal maintenance. With modern techniques, the procedure is safe, minimally invasive, and delivers long-lasting results, making it a popular choice for those seeking fuller, healthier hair.</p><p>Skinhealer Clinic combines expert care with advanced technology to deliver outstanding hair transplant results. Their team of experienced professionals ensures personalized treatment plans, natural outcomes, and patient comfort throughout the process. With a strong reputation, high success rate, and commitment to quality, Skinhealer is a trusted name in hair restoration.</p>","{'name': 'Hair Transplant', 'slug': 'hair-transplant'}","{'title': 'SkinHealer', 'slug': 'skinhealer', 'mini_content': '<p>SkinHealer Clinic, located in Greater Kailash, New Delhi, is a renowned dermatology and aesthetic wellness center that specializes in both medical and cosmetic treatments for skin and hair. The clinic is led by Dr. Mohit Kumar, a qualified homeopathic doctor with over 10 years of experience, who combines homeopathy with modern clinical cosmetology. With advanced training in aesthetic medicine, Dr. Kumar has successfully treated thousands of patients suffering from conditions such as acne, pigmentation, hair fall, dandruff, and various skin infections. SkinHealer Clinic is particularly known for offering a wide range of services including PRP therapy, mesotherapy, hair transplant, laser treatments, chemical peels, anti-aging solutions, and hydra facials. The clinic uses advanced technologies such as Q-switch lasers, CO2 fractional lasers, and HIFU for non-surgical facial lifting and scar reduction. What sets the clinic apart is its integrative approach—blending natural, drug-free therapies with state-of-the-art dermatological treatments, ensuring effective, long-lasting results with minimal side effects.</p><p><br></p><p><br></p><p><br></p><p><br></p><p><br></p>', 'content': 'SkinHealer Clinic in GK offers advanced, holistic skin and hair treatments combining homeopathy with modern aesthetics.', 'location': 'Greater Kailash-1, New Delhi'}","[{'name': 'Dr. Mohit Kumar', 'qualification': 'Medical graduation degree from Agra University', 'specialization': 'Trichologists'}]","{'min_price': '50000.00', 'max_price': '80000.00', 'currency': 'INR'}"
hair-transplant-alive-wellness-clinics-south-east-delhi,Advanced Hair Transplant Solutions at  Alive Wellness Clinics,"<p>Hair transplant is a surgical procedure that relocates healthy hair follicles to thinning or bald areas, providing a permanent and natural-looking solution to hair loss. Its importance lies in restoring confidence and appearance with results that blend seamlessly with existing hair. Techniques like FUE and FUT ensure minimal discomfort, quick recovery, and long-lasting outcomes. At Alive Wellness Clinics, advanced technology and personalized consultations guarantee that each treatment is tailored to individual needs. The procedure eliminates the need for temporary fixes, is cost-effective over time, and requires no special maintenance, making it a transformative, reliable choice for lasting hair restoration.</p><p>Alive Wellness Clinics in Delhi stands out for its experienced team, cutting-edge technology, and high success rates. Patients receive individualized care, comprehensive support from consultation to aftercare, and transparent guidance throughout the process. The clinic’s commitment to natural results and patient satisfaction makes it a premier destination for hair transplants in Delhi NCR.</p>","{'name': 'Hair Transplant', 'slug': 'hair-transplant'}","{'title': 'Alive Wellness Clinics, South East Delhi', 'slug': 'alive-wellness-clinics-south-east-delhi', 'mini_content': 'Alive Wellness Clinics offers expert dermatology and advanced aesthetic treatments. Experience holistic care and real results at the Lajpat Nagar center.', 'content': '<p><span style=""color: rgb(44, 62, 93); font-family: &quot;Open Sans&quot;, sans-serif; font-size: 16px;"">Alive Wellness Clinics is led by Dr. Chiranjiv Chhabra, a highly acclaimed cosmetic surgeon and wellness expert with over 25 years of experience. Dr. Chhabra’s vision and leadership have established the clinic as a center of excellence in dermatology and aesthetic medicine. Supported by a team of skilled dermatologists and cosmetologists, she ensures every patient receives personalized care tailored to their unique needs. The clinic is renowned for its holistic approach to beauty and wellness, offering a comprehensive range of advanced treatments for skin, hair, and body concerns. With state-of-the-art infrastructure and cutting-edge technology, Alive Wellness Clinics provides both invasive and non-invasive procedures in a welcoming, safe environment. Patients benefit from innovative solutions such as anti-aging therapies, body contouring, hair restoration, acne and pigmentation treatments, injectables, and regenerative therapies. The clinic’s commitment to patient education, safety, and excellence makes it a trusted choice for those seeking transformative results and a renewed sense of confidence and well-being.</span></p>', 'location': 'Lajpat Nagar, Delhi'}","[{'name': 'Dr. Chiranjiv Chhabra', 'qualification': 'MBBS, MD - Dermatology , Venereology & Leprosy', 'specialization': 'Hair Transplant'}]","{'min_price': '50000.00', 'max_price': '80000.00', 'currency': 'INR'}"
hair-transplant-scarlet-clinic,Best Hair Transplant,"<p>Hair transplant is an effective, long-term solution for thinning hair and baldness. It restores natural hair growth, improves appearance, and boosts self-confidence. The procedure is safe, minimally invasive, and requires little downtime. Results are permanent, with natural-looking density and hairline tailored to suit individual facial features and needs.</p><p>Scarlet Clinic offers expert care with advanced hair transplant techniques, ensuring natural results and high patient satisfaction. Their skilled team provides personalized treatment in a comfortable, hygienic environment. With a reputation for excellence, modern facilities, and transparent pricing, Scarlet Clinic stands out as a trusted destination for hair restoration.</p>","{'name': 'Hair Transplant', 'slug': 'hair-transplant'}","{'title': 'Scarlet Clinic', 'slug': 'scarlet-clinic', 'mini_content': 'Revitalize your skin and confidence at Scarlet Clinic.', 'content': 'Scarlet Clinic in Lajpat Nagar, Delhi, is a leading dermatology and aesthetic center offering a wide range of advanced skin and hair treatments. Under the expert care of Dr. Mukesh Manjhi, the clinic provides personalized solutions using the latest technology and internationally approved procedures. Their services include Carbon Peel for deep skin cleansing and rejuvenation, HIFU for non-invasive skin lifting and tightening, Microneedling to boost collagen and improve skin texture, and PRP therapy for both hair restoration and facial rejuvenation. Scarlet Clinic also offers advanced facials tailored to various skin types, dermal fillers and Botox for wrinkle reduction and volume restoration, as well as safe and effective laser hair removal. Additional treatments focus on acne and scar management, pigmentation correction, mole, wart, and skin tag removal, along with skin polishing to enhance texture and radiance. Open Monday to Saturday, Scarlet Clinic ensures a professional, client-focused environment dedicated to helping you achieve healthy, glowing skin.', 'location': 'Lajpat Nagar II, New Delhi'}","[{'name': 'Dr. Mukesh Manjhi', 'qualification': 'MBBS and MD in Dermatology', 'specialization': 'Dermatology'}]","{'min_price': '50000.00', 'max_price': '80000.00', 'currency': 'INR'}"
laser-hair-removal-kaya-clinic-west-delhi,Best Laser Hair Removal at Kaya Clinic,"<p>Laser hair removal is an advanced, long-lasting solution for reducing unwanted hair by targeting hair follicles with concentrated light. This treatment is important because it offers precise, virtually painless hair reduction with minimal risk of irritation or ingrown hairs, unlike traditional methods. Kaya Clinic uses US FDA-approved Nd-YAG and diode lasers, proven safe for Indian skin types, and customizes each session to individual needs for optimal results. Sessions are performed by certified professionals in a hygienic environment, ensuring safety and comfort. Over time, hair becomes finer and sparser, providing smooth, hair-free skin and saving time and money on regular maintenance.</p><p>Kaya Clinic West Delhi is a pioneer in laser hair removal, offering over two decades of expertise and state-of-the-art technology tailored to Indian skin. The clinic’s certified therapists provide personalized treatment plans, strict hygiene protocols, and transparent care, ensuring consistently effective, safe, and long-lasting results for every client.</p>","{'name': 'Laser Hair Removal', 'slug': 'laser-hair-removal'}","{'title': 'Kaya Clinic, West Delhi', 'slug': 'kaya-clinic-west-delhi', 'mini_content': 'Kaya Clinic offers expert dermatology and advanced aesthetic treatments in Punjabi Bagh. Experience personalized care and innovative solutions for skin, hair, and body concerns.', 'content': '<p><span style=""color: rgb(44, 62, 93); font-family: &quot;Open Sans&quot;, sans-serif; font-size: 16px;"">Kaya Clinic in Punjabi Bagh is staffed by renowned dermatologists, who are recognized for their expertise and patient-centered approach to skincare and hair care. The doctors at Kaya are highly trained in advanced dermatology and cosmetic treatments, ensuring personalized care for every individual. The clinic boasts a modern, spacious environment designed for comfort and safety, equipped with state-of-the-art technology for both medical and aesthetic procedures. Kaya Clinic is known for its welcoming ambiance and commitment to delivering world-class results. Patients can access a comprehensive range of treatments including laser hair removal, anti-aging solutions, skin tightening, pigmentation correction, acne and scar treatments, hair loss therapies, body contouring, and more. With a focus on innovation and quality, Kaya Clinic is a trusted destination for those seeking expert dermatological and aesthetic care in Delhi.</span></p>', 'location': 'Punjabi Bagh, Delhi'}","[{'name': 'Dr. Mansi Bansal', 'qualification': 'MBBS, MD - Dermatology , Venereology & Leprosy', 'specialization': 'Laser Hair Removal'}]","{'min_price': '10000.00', 'max_price': '20000.00', 'currency': 'INR'}"
hair-transplant-mediskin-laser-clinic-moti-bagh,Best Hair Transplant,"<p>A hair transplant provides a permanent, natural-looking solution to hair loss. It restores your hairline, adds volume, and boosts confidence. The procedure is safe, minimally invasive, and requires minimal maintenance post-recovery. With long-lasting results and improved aesthetics, it’s an effective choice for those seeking fuller, healthier hair growth.</p><p>Mediskin Laser Clinic combines expert dermatologists with cutting-edge technology to deliver precise, natural hair transplant results. Known for its patient-centric approach, the clinic ensures comfort, safety, and personalized care. With modern facilities, transparent consultations, and a track record of satisfied clients, Mediskin is a reliable choice for hair restoration.</p>","{'name': 'Hair Transplant', 'slug': 'hair-transplant'}","{'title': 'Mediskin Laser Clinic, Moti Bagh', 'slug': 'mediskin-laser-clinic-moti-bagh', 'mini_content': 'Mediskin Laser Clinic – Expert Skin & Laser Treatments in Moti Bagh, Delhi', 'content': '<p>Mediskin Laser Clinic, led by the renowned Dr. Nitin Verma and situated in Moti Bagh, South Delhi, is a premier destination for comprehensive dermatology and advanced laser treatments. Since 2008, Dr. Verma—an MBBS, DDVL-qualified specialist in cosmetic dermatology, dermatosurgery, trichology, and hair transplant—has been delivering personalized solutions for a wide range of skin and hair concerns. The clinic offers services ranging from basic dermatological care for conditions like eczema, psoriasis, vitiligo, and STDs to advanced aesthetic procedures such as Botox, dermal fillers, carbon reduction peel, Pico laser toning, IPL photofacial, CO₂ laser resurfacing, scar and acne scar removal, mole and wart removal, and various chemical peels including AHA, TCA, and salicylic acid. Additional services include microneedling, dermaroller, mesotherapy, PRP therapy, hydra facials, tattoo removal, stretch-mark treatment, body contouring, cellulite reduction, laser hair removal, and hair transplant procedures. Equipped with cutting-edge laser technologies, Mediskin ensures safe, effective, and visible results in a comfortable, patient-friendly environment.&nbsp;</p>', 'location': 'Moti Bagh-2, Delhi'}","[{'name': 'Dr Nitin Verma', 'qualification': 'MBBS, DDVL (Diploma In Dermatology Venerology & Leprosy)', 'specialization': 'Hair Transplant Surgery'}]","{'min_price': '50000.00', 'max_price': '80000.00', 'currency': 'INR'}"
hair-transplant-dr-siddiquis-skin-clinic,Best Hair Transplant,"<p>Hair transplant is a permanent and natural solution to hair loss, restoring confidence and enhancing appearance. The procedure is minimally invasive with a quick recovery time. It delivers natural hair growth tailored to individual needs, offering long-term results without the need for ongoing treatments or excessive maintenance.</p><p>Dr. Siddiqui Clinic is known for its expertise, advanced techniques, and patient-focused care in hair restoration. Led by experienced professionals, the clinic offers personalized treatment plans, high success rates, and natural-looking results. With modern facilities and a commitment to quality, it’s a trusted destination for safe and effective hair transplants.</p>","{'name': 'Hair Transplant', 'slug': 'hair-transplant'}","{'title': ""Dr. Siddiqui's Skin Clinic"", 'slug': 'dr-siddiquis-skin-clinic', 'mini_content': 'Expert skin and hair care by Dr. Siddiqui in Zakir Nagar, offering personalized dermatology and aesthetic treatments.', 'content': ""<p>Dr. Siddiqui’s clinic in Zakir Nagar, Delhi, is a trusted destination for comprehensive skin and hair care solutions. With years of experience in clinical and aesthetic dermatology, Dr. Siddiqui offers personalized treatments tailored to each patient’s unique concerns. The clinic specializes in managing common and complex skin conditions such as acne, pigmentation, eczema, psoriasis, fungal infections, and vitiligo, along with effective treatments for hair fall, dandruff, and scalp issues. Advanced cosmetic procedures are also available, including chemical peels, PRP therapy, skin rejuvenation, anti-aging treatments, and wart or mole removal. Using safe, evidence-based methods and the latest dermatological technology, Dr. Siddiqui ensures that every patient receives high-quality care in a comfortable and professional environment. Whether you're dealing with a chronic skin issue or simply want to enhance your natural glow, the clinic provides honest guidance, effective results, and ongoing support and experience expert skin and hair care with a personal touch in Zakir Nagar.</p><div><br></div>"", 'location': 'Zakir Nagar, Delhi'}","[{'name': 'Dr. Aamir Siddiqui', 'qualification': 'MBBS, MD - Skin, VD & Leprosy', 'specialization': 'Dermatologist'}]","{'min_price': '50000.00', 'max_price': '80000.00', 'currency': 'INR'}"
laser-hair-removal-skin-well-clinic-west-delhi,Best Laser Hair Removal at Skin Well Clinic,"<p>Laser hair removal is a modern, non-invasive treatment that uses advanced laser technology to target and reduce unwanted hair growth. Its significance lies in providing a long-term solution that is both safe and highly effective for all skin types and body areas. Unlike traditional methods, laser hair removal minimizes discomfort, reduces the risk of ingrown hairs, and offers smoother, clearer skin with each session. The procedure is quick, hygienic, and requires minimal downtime. Over time, hair regrowth becomes finer and lighter, resulting in substantial savings of time and money. This treatment enhances confidence and simplifies personal grooming routines.</p><p>Skin Well Clinic stands out for its use of state-of-the-art diode laser technology, experienced dermatologists, and personalized care protocols. The clinic ensures safe, effective treatments tailored to individual skin and hair types, maintaining high hygiene standards and transparent communication. Clients benefit from lasting results, comfort, and a professional, patient-focused environment.</p>","{'name': 'Laser Hair Removal', 'slug': 'laser-hair-removal'}","{'title': 'Skin Well Clinic, West Delhi', 'slug': 'skin-well-clinic-west-delhi', 'mini_content': 'Skin Well Clinic offers expert dermatology and advanced cosmetic treatments in East Punjabi Bagh.Experience personalized care and modern solutions for skin, hair, and body concerns.', 'content': '<p>Dr. Ridhima Lakhani and Dr. Gaurav Bhardwaj are the expert dermatologists behind Skin Well Dermatology &amp; Cosmetology Clinic. Both are highly qualified, with Dr. Lakhani holding an MBBS, MD and DNB in Dermatology, and Dr. Bhardwaj Holding MBBS, MD bringing extensive experience in medical and cosmetic dermatology. Their clinic is recognized for its warm, patient-friendly environment and commitment to using advanced technology for safe, effective treatments. Skin Well Clinic specializes in a comprehensive range of aesthetic skin and hair treatments, including laser hair removal, botox, dermal fillers, chemical peels, microdermabrasion, skin tightening, acne and scar treatment, hair transplant, PRP therapy for hair growth, pigmentation and melasma treatment, skin rejuvenation, anti-aging therapies, and scalp treatments. These services are tailored to help patients achieve healthy, radiant skin and strong, beautiful hair, making Skin Well Clinic a trusted destination for dermatological and aesthetic care in East Punjabi Bagh</p>', 'location': 'Punjabi Bagh, Delhi'}","[{'name': 'Dr. Gaurav Bhardwaj', 'qualification': 'MBBS, MD - Dermatology , Venereology & Leprosy', 'specialization': 'Laser Hair Removal'}]","{'min_price': '10000.00', 'max_price': '20000.00', 'currency': 'INR'}"
